original_text,reference_summary
anonymous encrypted code representing internet protocol ip address device identifier using mobile device used persistent identifier anonymous login information browser type version time zone setting browser plug type version operating system version device information . well . ,service may use tracking pixel web beacon browser fingerprinting device fingerprinting user . 
may amend update term . unless otherwise required law provide least 30 day notice amendment term give opportunity review revised term continuing use service . also update last modified date top term . change term shall become effective sooner 30 day provide notice planned change . please note may able provide notice change term required address technical evolution service change made legal reason become effective immediately . continued use service following notice period planned change confirms acceptance term amended . ,change term service time see fit even without notification user . use service supposedly constitutes acceptance change term . 
time respond browser track signal await work interested stakeholder others develop standard signal interpreted . ,service ignores track dnt header track user anyway even set header . 
submitting feedback grant u right use feedback without restriction compensation . ,offer suggestion service become owner idea give . 
sale personal information librarything sell give personally identifiable information third party . would evil evil . yes still . ,librarything sell give personally identifiable information third party . 
fullest extent permitted applicable law spotify owner content make representation disclaim warranty condition satisfactory quality merchantability fitness particular purpose non infringement . neither spotify owner content warrant spotify service free malware harmful component . ,guarantee quality service . service delivered expectation still pay extent applicable law . 
use web beacon analytics service microsoft web page may contain electronic image known web beacon also called single pixel gifs use help deliver cooky site count user visited site deliver co branded service . also include web beacon promotional email message newsletter determine whether open act . ,tracking pixel used service user communication . 
15 7 agreement terminated entitled restoration airbnb account member content . access use airbnb platform limited airbnb account suspended agreement terminated u may register new airbnb account access use airbnb platform airbnb account another member . ,user permanently banned service allowed register new account . 
agree defend indemnify hold harmless site affiliate licensors respective officer director employee contractor agent licensors claim liability damage judgment award loss cost expense fee including reasonable attorney fee resulting violation term condition use site including without limitation use site content service item purchased site . ,agree defend indemnify hold service harmless case claim related use service . 
may also block delivery communication like email file sharing instant message service effort enforce term may remove refuse publish content reason . ,service delete specific content without prior notice without reason . 
product research development use information develop test improve product including conducting survey research testing troubleshooting new product feature . ,facebook us data many purpose . 
information produce response request like date time user registered signal last date user connectivity signal service . notably thing stored include anything user contact contact hash contact derivative contact information anything user group many group user group user membership list user group record user communicating . message content end end encrypted information either . ,necessary user log kept service ensure quality . 
also enables u serve advertising relevant content academia edu service . ,service us personal data employ targeted third party advertising . 
case subject third party advertiser privacy policy . please note however control third party advertiser service provider e. third party advertiser service provider solely determine purpose mean processing personal data thus data controller . generally access information collected . ,third party may involved operating service . 
without advance notice time may violation agreement reason choose 1 suspend access reddit 2 suspend terminate account reddit gold membership 3 remove user content reddit . ,service delete account without prior notice without reason . 
use cooky text file placed computer help u analyze user use service similar technology e g. web beacon pixel ad tag device identifier recognize device across different device service well improve service offering improve marketing analytics website functionality . use cooky standard internet . although web browser automatically accept cooky decision whether accept . may adjust browser setting prevent reception cooky provide notification whenever cookie sent . may refuse use cooky selecting appropriate setting browser . management use cooky browser detailed following help page http support steampowered com kb_article php ref 9076 qyoj 0930. however please note may able access full functionality website . visit service server log global ip address number automatically assigned network computer part . ,service may use tracking pixel web beacon browser fingerprinting device fingerprinting user . 
cnn reserve right sole discretion remove edit user content . ,service delete specific content without prior notice without reason . 
cease using discogs service confirm discogs entitled continue using user generated content may continue display user name along content pursuant right granted . ,service keep license user generated content even user close account . 
gitlab reserve right sole discretion modify replace part agreement . responsibility check agreement periodically change . continued use access website following posting change agreement constitutes acceptance change . gitlab may also future offer new service feature website including release new tool resource . new feature service shall subject term condition agreement . gitlab may also future remove feature time without warning . ,service make critical change term without user involvement . 
minimum age consent enter contract jurisdiction may use access service time manner . example united state must least 13 year age establish account use service must least 18 year old purchase sell item service . ,use discogs user must minimum age consent varies jurisdiction . case united state user must least 13 year old sign account 18 year old buy sell item discogs . 
agree resolve claim u relating arising term u service exclusively united state district court northern district california state court san mateo county california . also agree submit personal jurisdiction court purpose litigating dispute . law state california govern term well dispute whether court arbitration might arise signal without regard conflict law provision . ,court law governing term california . 
open book publisher send email agreed receive . member mailing list may contacted announcement news portfolio addition new product service . email sent option unsubscribing mailing list time thereby disabling email communication sent . ,opt promotional communication . 
buyer successor event merger divestiture restructuring reorganization dissolution sale transfer site asset whether going concern part bankruptcy liquidation similar proceeding personal information site user among asset transferred . ,service sell otherwise transfer personal data part bankruptcy proceeding type financial transaction . 
solely responsible activity connection access site service account using password security computer system event shall grammarly liable loss damage relating activity . ,responsible maintaining security account activity account . 
github right suspend terminate access part website time without cause without notice effective immediately . github reserve right refuse service anyone reason time . ,account suspended data deleted time reason . 
privacy notice posted may 1 2015. effective upon acceptance new user june 15 2015 user . see previous version privacy notice . ,ebay previous privacy notice available viewing . 
collect personal data . qwant require registration use search engine . however may want register account sign enjoy advanced functionality possibility save search result favorite create board . case collect personal data name firstname email address register service use form available website . modify correct update information submit website . qwant also collect connection data associated search query ensure security information system create modify board respect obligation identify content creator mandated french law article 6 ii de la loi pour la confiance en l économie numérique . even connected id use cookie tracking device browse site . technology may installed browser called local storage used locally save setting language activation deactivation option . delete personal data stored local storage deactivating cooky browser . however deactivation may prevent accessing functionality site browsing preference . user personal data collected processed qwant solely following purpose technical management user account available service management information request job application management delisting request request associated personal data access rectification removal right security qwant information system compliance legal regulatory obligation . ,service provides information intend use personal data . 
content create share facebook facebook product use nothing term take away right content . ,allow facebook use data explicitly state maintain ownership . 
may update privacy policy reflect change information practice . make change use personal information notify email sent e mail address specified account . encourage periodically review page latest information privacy practice . ,user revisit term periodically although case material change service notify . 
policy last updated 1 june 2018 reviewed every 12 month . ,service review privacy policy regular basis . 
disclaimer warranty expressly understand agree use service sole risk . service provided available basis . discogs expressly disclaims warranty kind whether express implied including limited implied warranty merchantability fitness particular purpose non infringement . ,service provided used user sole risk . 
15 3 unless country residence united state without limiting right specified airbnb may terminate agreement convenience time giving thirty 30 day notice via email registered email address . ,service give 30 day notice closing account . 
solely responsible damage computer system network well data loss may result use npm service material received via npm service . ,user responsible risk damage loss may incur downloading material . 
reserve right remove modify content submitted reason without explanation . request content removed modified undertaken discretion . ,service delete specific content without prior notice without reason . 
e discogs promote condone idea message contained item listed via service . ,discogs distance message idea user include content generate website . 
use cooky facebook account use facebook product including website apps visit website apps use facebook product including like button facebook technology . ,facebook us cooky . 
cooky web beacon pixel tag clear gifs similar file technology may used collect store information automatically collected computer device service usage . ,service may use tracking pixel web beacon browser fingerprinting device fingerprinting user . 
nothing considered legal advice . express opinion guarantee endorse service way . please refer qualified attorney legal advice . reading tos dr way replacement reading full term bound . ,tos dr give guarantee regarding quality . 
15 1 agreement shall effective 30 day term end automatically continuously renew subsequent 30 day term time airbnb terminate agreement accordance provision . 15 2 may terminate agreement time sending u email . cancel airbnb account host confirmed booking automatically cancelled guest receive full refund . cancel airbnb account guest confirmed booking automatically cancelled refund depend upon term listing cancellation policy . ,user right cancel account time . however cancellation effective 30 day term agreement . 
circumstance information may shared u third party specifically consented . example include registering human right education course external provider register interest joining amnesty international one campaign facebook facebook share information name email address u . ,service share user information third party given specific consent . 
visiting using service agree law united state state california without regard principle conflict law regardless location govern term dispute sort might arise company . claim dispute company arises whole part term use service shall decided exclusively court competent jurisdiction located santa clara county california hereby consent waive defense lack personal jurisdiction forum non conveniens respect venue jurisdiction state federal court santa clara county california . ,user agree comply law service country . 
wish cancel account request longer use information provide service request longer maintain information please contact u info reputation com . ,reputation com service canceled online via email guaranteed response time . 
data store account¹ account number expiry date . ,service log user information . 
claim ownership right user content created . user content create remains . however sharing user content service agree allow others view edit share user content accordance agreement see user content license grant . ,company take ownership content posted . however grant user right view modify share created content . 
researchgate strives connect world science . essential credibility world science reputation researcher researcher identify using real name affiliation . must therefore provide true non misleading statement real name . may use pseudonym pen name . may accept adopt post content falsely misleadingly implies incorrect identity inaccurate biographical fact misleading information qualification work experience achievement . warrant represent personal information provide accurate complete . obliged update data change . choose use profile photo must use photo clearly identified . image people animal text logo permitted . essential credibility researcher using service best interest world science . ,pseudonym allowed user user trust relevant service . 
disclaimer warranty ii service uninterrupted timely secure error free . ,service provider make warranty regarding uninterrupted timely secure error free service . 
email communication contain unsubscribe link . ,opt promotional communication . 
may share information vendor consultant service provider advertiser ad partner need access information carry work u . partner use personal data subject appropriate confidentiality security measure . ,reddit share data third party . 
collect content file communication necessary provide service use . ,service read private message . 
nothing agreement give npm ownership right intellectual property share npm service account information package share npm service content . ,maintain ownership data . 
agree upload post otherwise transmit user content violates infringes way upon right others including statement may defame harass stalk threaten others . ,user agree submit libelous harassing threatening content . 
one account per user allowed . user caught one account may permanently banned account disabled . ,service allow alternative account . 
500px agree proceeding resolve litigate dispute arising hereunder conducted solely individual basis seek dispute heard class action representative action collective action private attorney general action proceeding act propose act representative capacity . agree proceeding joined consolidated combined another proceeding without prior written consent 500px party proceeding . ,waive right class action . 
upload submit store send receive content service give google work worldwide license use host store reproduce modify create derivative work resulting translation adaptation change make content work better service communicate publish publicly perform publicly display distribute content . ,copyright license grant limited purpose operating promoting improving existing new google service . however please note license end stop using google service . 
termination agree discogs sole discretion may terminate account remove discard content within service reason including without limitation lack use discogs find violated acted inconsistently letter spirit tos . agree termination access service provision tos may effected without prior notice acknowledge agree discogs may immediately deactivate delete discogs account related information file . discogs reserve right bar access file service . agree discogs shall liable third party termination access service . advanced account terminated refunded . object term condition tos subsequent modification thereto become dissatisfied service way recourse immediately discontinue use service . upon termination service right use service immediately cease . shall right discogs obligation thereafter forward unread unsent message third party . ,discogs delete account without prior notice without reason . 
signal may update term time time . update term update last modified date associated updated term . continued use service confirms acceptance updated term supersedes prior term . comply applicable export control trade sanction law . term cover entire agreement signal regarding service . agree term stop using service . ,term may changed time discretion without notice user . 
cooky better serve occasionally use cooky customize browsing experience . cooky simple text file stored web browser provide method distinguishing among visitor web site . cooky created computer using web site contain personally identifiable information compromise privacy security . use cookie feature store randomly generated identifying tag computer . refuse cookie delete cookie file computer time using one number widely available method . ,cooky used service contain information would personally identify . 
also agree register one account use site . site administrator reserve right ban user accessing site one account . information obtain use site including registration data subject privacy policy specifically incorporated reference term use . ,service allow alternative account . 
either party may terminate agreement party breach material obligation fails cure within 30 day receipt written notice ii party becomes insolvent bankrupt liquidated dissolved cease substantially business may suspend access terminate immediately breach section 1 2 4 5. lastpass right though obligation lastpass sole discretion refuse remove content lastpass reasonable opinion violates lastpass policy way harmful objectionable ii terminate deny access use website individual entity reason lastpass sole discretion . ,user suspension service fair proportionate . 
log data . website technology service delivered internet server automatically collect information access use website service record log file . log data may include internet protocol ip address address web page visited using website service browser type setting date time service used information browser configuration plugins language preference cookie data . ,service may use tracking pixel web beacon browser fingerprinting device fingerprinting user . 
created user account bear sole responsibility information fill registering modifying account . acknowledge alone responsible content consequence following aggregation shared board . agree put required permission right license consent authorization allowing share information . hand allowed publish content includes element legally authorized posse . held responsible content may infringe upon right others applicable law including rule related right one image right regarding intellectual property shared content . ,responsible maintaining security account activity account . 
may may allow third party service provider use cooky similar technology collect information browsing activity time across different website following use site . ,service track website . 
law california u excluding california conflict law rule apply dispute arising relating term service . law california u excluding california conflict law rule apply dispute arising relating term service . claim arising relating term service litigated exclusively federal state court santa clara county california usa google consent personal jurisdiction court . ,court law governing term california . 
use information collected . use personal information collected via website following purpose undertake email action compile petition update campaign activity ask donate get involved campaign action expression interest joining amnesty international administer membership amnesty international process donation receive administer progress application employment volunteering opportunity u monitor diversity applicant employment volunteering opportunity share data amnesty international organisation trusted third party detail improve website fulfil legal obligation . ,service provides information intend use personal data . 
github us cooky make interaction service easy meaningful . use cooky similar technology like html5 localstorage keep logged remember preference provide information future development github . also use cooky identify device security reason . using website agree place type cooky computer device . disable browser device ability accept cooky able log use github service . provide web page cooky tracking describes cooky set need cooky type cooky temporary permanent . also list third party analytics service provider detail exactly part website permit track . ,github requires cooky . 
cookie small piece data stored computer mobile device . like many website use cooky similar technology collect additional website usage data operate service . cooky required many part service searching looking public profile . although web browser automatically accept cooky many browser setting set decline cooky alert website attempting place cookie computer . however service may function properly disable cooky . browser device allows use session cooky persistent cooky better understand interact service monitor aggregate usage pattern personalize otherwise operate service providing account security personalizing content show including ad remembering language preference . support track browser option . learn use cooky similar technology . pagereference content twitter com legal en privacy chapter 2 chapter 2 3 tooltips overlay content hungry . change cookie setting web browser . ,twitter transparent using session cooky persistant cooky . twitter require cooky service function . remember cooky file computer control disable . 
use cooky tracking purpose . ,service us temporary session cooky . 
unless otherwise agreed written agreement twitch signed authorized representative twitch submit transmit display perform post store user content using twitch service grant twitch sublicensees furthest extent maximum duration permitted applicable law including perpetuity permitted applicable law unrestricted worldwide irrevocable fully sub licenseable nonexclusive royalty free right use reproduce modify adapt publish translate create derivative work distribute perform display user content including without limitation promoting redistributing part twitch service derivative work thereof form format medium medium channel known later developed discovered . b use name identity likeness voice biographical information submit connection user content . ,twitch use appropriate broadcaster content anything . 
nanowrimo claim copyright project created shared website held liable content therein . ,maintain ownership data . 
since like button little piece facebook embedded another website browser sending info request load facebook content page . record info help show personalized experience site improve product . ,service track website . 
bumble trading inc reserve right sole discretion terminate suspend account make use operational technological legal mean available enforce term including without limitation blocking specific ip address time without liability without need give prior notice . ,service delete account without prior notice without reason . 
respect content material upload site share user recipient collectively user content represent warrant right title interest user content including without limitation copyright right publicity contained therein . ,maintain ownership data . 
agree use service submit link content defamatory abusive hateful threatening spam spam like likely offend contains adult objectionable content contains personal information others risk copyright infringement encourages unlawful activity otherwise violates law . ,user agree submit illegal content . 
information collected automatically stack overflow receives record information browser mobile device visit network use apps internet protocol ip address unique device identifier . cooky data page visit network allow u operate optimize product service provide . information stored secure log collected automatically . may combine browser information information collect . information used keep product service secure analyze understand product service used optimize usage provide advertising across network well certain product service personalize experience help connect potential job opportunity case recruiting product service . ,service us personal data advertising . 
