original_text,reference_summary
guarantee information provided patook user patook accurate . regularly verify personal information provided patook user . also includes limited date birth location age . ,service guarantee accuracy reliability information provided . 
entirely responsible activity occur account maintain confidentiality password account . furthermore entirely responsible activity occur account someone authorize use account . ,responsible maintaining security account activity account . 
collection static page active content . script cooky ad tracker facebook link anything else might poke around private part . log register pay sell soul order use . browse read long wish leave done . feel free . ,ip address website visitor tracked . 
seek file legal claim u agree file resolve exclusively state federal court located san francisco county california . also agree law state california extent applicable law united state america govern term use well legal claim might arise u without reference conflict law principle . agree submit personal jurisdiction agree venue proper court located san francisco county california legal action proceeding relating u term use . ,court law governing term san francisco county california . 
netflix may time time change term use . revision shall effective immediately . provided however existing member revision shall unless otherwise stated effective 30 day posting . ,change term service time see fit even without notification user . use service supposedly constitutes acceptance change term . 
agree arbitration agreement class action waiver described section 7 resolve dispute netflix except matter may taken small claim court . ,waive right class action . 
addition websaver ca may sole discretion time discontinue providing limit access site area site . ,may stop providing service time . 
measure reach effectiveness advertisement campaign offer targeted advertising personalize experience showing advertisement product service likely appeal e. behavioral advertising . ,service us personal data employ targeted third party advertising . 
great fun bumble feel need leave delete account time going setting page logged clicking delete account link . account deleted immediately may take little content completely removed app . ,right leave service time . 
must use automated script software collect information content cybernet site way . ,user scrape website service . 
hereby grant youtube worldwide non exclusive royalty free sublicenseable transferable license use reproduce distribute prepare derivative work display perform content connection service youtube successor affiliate business including without limitation promoting redistributing part service derivative work thereof medium format medium channel . also hereby grant user service non exclusive license access content service use reproduce distribute display perform content permitted functionality service term service . ,user grant youtube worldwide non exclusive royalty free license sublicenseable transferable used without limitation promotion service medium format medium channel provided connection youtube successor affiliate . 
request delete account system immediately lock account archive information delete severs within approximately 7 day date request . ,delete content service . 
personal information provide u stored password protected server accessible administrator . ,private content may accessed people working service . 
21. applicable law jurisdiction 21 1 country residence united state term interpreted accordance law state california united state america without regard conflict law provision . judicial proceeding small claim action excluded arbitration agreement section 19 must brought state federal court san francisco california unless agree location . consent venue personal jurisdiction san francisco california . 21 2 country residence china term interpreted accordance law china china law . dispute arising connection agreement shall submitted china international economic trade arbitration commission cietac arbitration beijing shall conducted accordance cietac arbitration rule effect time applying arbitration provided section shall construed limit right airbnb may apply court competent jurisdiction order requiring perform prohibited performing certain act provisional relief permitted china law law may apply . arbitration proceeding shall conducted english . arbitral award rendered final binding upon party . 21 3 country residence outside united state china term interpreted accordance irish law . application united nation convention contract international sale good cisg excluded . choice law impact right consumer according consumer protection regulation country residence . acting consumer agree submit non exclusive jurisdiction irish court . judicial proceeding able bring u arising connection term may brought court located ireland court jurisdiction place residence . airbnb wish enforce right consumer may court jurisdiction resident . acting business agree submit exclusive jurisdiction irish court . ,reside united state america court law san francisco california . reside china dispute must submitted china international economic trade arbitration commission cietac proceeding shall held english incredibly unfair chinese native . country residence outside united state china irish law applies agree submit jurisdiction irish court . 
posting visual content site grant 500px non exclusive exclusive transferable fully paid worldwide license use sublicense distribute reproduce modify adapt publicly perform publicly display visual content connection service . license exist period visual content posted site automatically terminate upon removal visual content site subject term license granted authorized 500px distributor license granted 500px includes right use visual content fully partially promotional reason distribute redistribute visual content party website authorized agent application entity provided visual content attributed accordance required credit e. username collection name profile picture photo title description tag accompanying information appropriate submitted 500px subject credit requirement governing licensing visual content pursuant contributor agreement notwithstanding foregoing inadvertent failure provide appropriate attribution shall considered breach term 500px distributor right modify alter amend photo title description tag metadata accompanying information visual content right submit visual content party authorized agent purpose creating tag visual content . ,copyright license grant 500px transferable sublicensable . copyright license limited use connection service includes promotional us redistribution party web site application entity credited properly . license content terminates remove content . 
collect personal information following way sign online action express interest joining u international member make donation u sign human right education course participate online campaign activity example amnesty decoder apply job volunteering opportunity u . ,service provides information collect personal data . 
b discogs make warranty v error software corrected . ,service guarantee software error corrected . 
information collected visit web site maintained city reading read download information collect following information name domain . example xcompany com use private internet access account yourschool edu connecting university domain ip address . number automatically assigned computer using internet type browser operating system used access site internet address website linked directly site page visit within city site . link made web site site . information collected statistical analysis using standard third party software program create summary statistic . statistic used purpose determining information least interest visitor identifying system performance problem area . information collected commercial marketing purpose city sell information collected online commercial marketing purpose . visit city web site voluntarily provide personally identifiable information collect information . example personally identifiable information may include email address communicating u email information voluntarily submit city purpose completing submitting application form online . information volunteered survey information content email . general please note information collected whether personally identifiable limited text character may include audio video graphic format send u . information retained accordance existing law city policy . ,service provides detail kind personal information collect . 
granting u non exclusive permanent irrevocable unlimited license use publish publish content connection service . ,copyright license user grant service limited purpose service third party . 
law state california extent preempted inconsistent federal law govern term claim without regard conflict law provision . ,court law governing term state california . 
jetbrains reserve exclusive right revoke authorization view download print site content time shall discontinue use immediately upon notice jetbrains . ,service delete account without prior notice without reason . 
example go website like button need know order show facebook friend liked site . data receive includes user id website visiting date time browser related info . logged facebook account visit website like button another social plugin browser sends u limited set info . example logged facebook fewer cooky someone logged . like site internet receive info web page visiting date time browser related info . record info help u improve product . data policy indicates use cooky show ad facebook . may also use info receive visit site social plugins help u show interesting useful ad . ,service track website . 
may revise term time time better reflect change law b new regulatory requirement c improvement enhancement made service . update affect use service legal right user service notify prior update effective date sending email email address associated account via product notification . updated term effective le 30 day notify . agree update make please cancel account become effective . ,change term service time see fit notify user . use service supposedly constitutes acceptance change term . 
advertising cooky cooky widely used online advertising . neither u advertiser advertising partner gain personally identifiable information cooky . ,service allows tracking via third party cooky purpose including targeted advertising . 
use cooky tracking technology . ,service track . 
client server software remain free accessible generally accepted open license . ,feature website made available free software license . 
apple reserve right sole discretion change modify add remove portion term use time . responsibility check term use periodically change . continued use site following posting change mean accept agree change . ,apple may change term use time responsibility keep date change . using site accept term . 
valve may amend agreement including subscription term rule use unilaterally time sole discretion . case notified e mail amendment agreement made valve within 60 sixty day entry force said amendment . view agreement time http www steampowered com . failure cancel account within thirty 30 day entry force amendment constitute acceptance amended term . ,service want change term user notified month advance . 
permitted attempt overload flood spam mailbomb crash website server . ,service prohibits user sending chain letter junk mail spam unsolicited message . 
use service subject applicable local state national international law regulation . agree 1 comply u applicable international law regarding transmission technical data exported country service . ,user agree comply u law . 
contains information content illegal . ,user agree submit illegal content . 
use cookie ad tracking device pixel fingerprinting browsing service . ,service track . 
extent necessary order soundcloud provide aforementioned hosting service undertake task set forth term use including distribution advertising promotional material platform enable use platform hereby grant license soundcloud limited worldwide non exclusive royalty free fully paid basis . uploading content platform also grant limited worldwide non exclusive royalty free fully paid license user platform operator user website apps platform content shared embedded using service linked service use copy listen offline repost transmit otherwise distribute publicly display publicly perform adapt prepare derivative work compile make available otherwise communicate public content utilizing feature platform time time within parameter set using service . ,grant soundcloud right necessary operate service . grant public right listen share track within parameter set track . also publish easily track creative common license choice . 
give personal legal name create npm account . use pseudonym instead . ,service allows use pseudonym . 
ad identifier non permanent non personal identifier android advertising id apple id advertising idfa uniquely associated device . similar technology include tracking pixel within ad . ,service may use tracking pixel web beacon browser fingerprinting device fingerprinting user . 
apple may change add remove part term time . apple post change www apple com internetservices term . future change unacceptable discontinue using service . continued use service following posting notice change indicate acceptance term change . ,change term service time see fit even without notification user . use service supposedly constitutes acceptance change term . 
cooky small data file commonly stored device browse use website online service . widely used make website work work efficiently well provide reporting information assist service advertising personalization . cooky type technology enable functionality . also use similar type technology . see information example . advertising identifier . advertising identifier similar cooky found many mobile device tablet example identifier advertiser idfa apple io device google advertising id android device certain streaming medium device . like cooky advertising identifier used make online advertising relevant . netflix use cooky advertising identifier . essential cooky cooky strictly necessary provide website online service . example service provider may use cooky authenticate identify member use website application provide service . also help u enforce term use prevent fraud maintain security service . performance functionality cooky cooky essential help u personalize enhance online experience netflix . example help u remember preference prevent needing enter information previously provided example member sign . also use cooky collect information popular page conversion rate viewing pattern click information visitor use netflix service enhance personalize website service conduct market research . deletion type cooky may result limited functionality service . advertising cooky advertising identifier cooky advertising identifier use information use website apps response ad email deliver ad relevant . type ad called interest based advertising . many advertising cooky associated service belong service provider . exercise choice regarding cooky advertising identifier . information cooky set website well type online tracking including collection information third party online activity time across third party web site online service online interest based advertising exercise choice regarding click . opt interest based ad netflix connection advertising identifier mobile device tablet streaming medium device please configure appropriate setting device usually found privacy ad device setting . may still see netflix ad device tailored likely interest . netflix support following self regulatory program provide additional privacy choice interest based advertising u digital advertising alliance daa europe european interactive digital advertising alliance edaa canada ad choice digital advertising alliance canada daac choix de pub l alliance de la publicité numérique du canada daac time respond web browser track signal . netflix use web beacon technology . web beacon also known clear gifs pixel tag often work conjunction cooky . service provider may use similar purpose cooky understand enhance use service improve site performance monitor visitor traffic action site understand interaction marketing including email online ad third party site . web beacon often work conjunction cooky many case declining cooky impair effectiveness web beacon associated cooky . use technology similar cooky browser storage plugins e g html5 indexeddb websql . like cooky technology may store small amount data device . may use various technology similar purpose cooky enforce term prevent fraud analyze use service . number way exercise choice regarding technology . example many popular browser provide ability clear browser storage commonly setting preference area . see browser help function support area learn . technology silverlight storage may cleared within application . ,cooky required . 
modification service discogs reserve right modify discontinue service without notice . discogs shall liable third party discogs exercise tos right modify discontinue service . ,service discontinued also modified time . discogs need notify user change . 
work third party provide service . example third party provider send verification code phone number register service . provider bound privacy policy safeguard information . use third party service like youtube spotify giphy etc . connection service term privacy policy govern use service . ,third party may involved operating service . 
13 year age authorized register use site . ,service available user certain age . 
public disclosure general rule city disclose personally identifiable information collected online except given u permission information public information pennsylvania right know act 65 p s. 66 1 et seq applicable law . visitor aware information collected city website may subject examination inspection information public record otherwise protected disclosure . ,service allow third party access personal information without legal basis . 
use qwant personal information whatsoever neither captured transmitted advertiser . detail third party cooky tracker behavioral targeting campaign mixing legit promotional content native advertising use cookie tracking device may allow u track browsing habit establish profile . ,service us temporary session cooky . 
use cooky help u show ad make recommendation business organization people may interested product service cause promote . ,service us personal data employ targeted third party advertising . 
cancelling account scramble data database recover account loose contribution . ,service continue using anonymized user generated content even erasure personal information . 
npm make warranty npm service meet requirement operate uninterrupted timely secure error free manner . ,service provider make warranty regarding uninterrupted timely secure error free service . 
term relationship weebly shall governed law state california without regard conflict law provision . ,court law governing term location state california . 
post member content service hereby grant u perpetual e. lasting forever worldwide irrevocable non exclusive royalty free fully sublicensable e. grant right others license use reproduce display perform adapt modify create derivative work distribute distributed promote member content form medium known hereinafter created including email communication member administer operate develop otherwise provide couchsurfing service . ,may retain certain information required law legitimate business purpose protect member safety . say hold data already closed account order help combat fraud platform . 
may change password time . may also set new account close old one convenience . ,right leave service time . 
may change price term service agreement time . provide notice material change may provide notice nonmaterial change . use service change take effect accepting change . ,user revisit term periodically although case material change service notify . 
contest survey sweepstakes data personal data used allow sign participate type promotion . exact personal data collected vary depending promotion . ,spotify may merge current personal info participate special promotion . 
please aware may transfer information israel european union country certain third party use operate manage site service including amazon web service aws google cloud service . ,data may processed stored anywhere world . 
place agreement service provider restrict able process personal information . ,third party used service bound confidentiality obligation . 
unless provide specific consent airbnb claim ownership right member content nothing term deemed restrict right may use exploit member content . ,maintain ownership data . 
court find portion tos unenforceable invalid portion enforced fullest extent permitted applicable law remainder tos remain valid enforceable . ,one portion tos invalid discogs enforce much possible applicable law . invalidity one portion affect provision tos . 
disclose information service provider working behalf provide website hosting maintenance security service . fulfill order . conduct data analysis create report . offer certain functionality . assist twitch improving twitch service creating new service feature . require party process information compliance privacy policy authorize use information purpose provided require use reasonable confidentiality measure . twitch may make information available affiliate meaning entity controlled controlling common control twitch including amazon com inc subsidiary either subject privacy policy follow practice least protective described privacy policy . ,service us personal information many different purpose . 
may change term condition reflect change applicable law . b regulatory security requirement . c relevant guidance code practice . technical alteration jagex product . e improve clarity consistency . please check term condition whenever use jagex product . subscriber treat continued use jagex product acceptance change effective date shown . subscriber treat first renewal date subscription change acceptance change . agree change cancel subscription explained section 14 term condition renewal date . ,subscriber jagex treat first renewal date subscription change acceptance change . 
happens someone sue sprint based something actually caused . agree indemnify defend hold sprint subsidiary affiliate parent company vendor supplier licensors harmless claim arising relating action including limited use service information submit post transmit make available via service . failing provide appropriate notice regarding location enabled service . failure safeguard password backup question shared secret question account information . violating agreement policy referenced agreement applicable law regulation right third party . ,agree defend indemnify hold service harmless case claim related use service . 
signed google account store information collect unique identifier tied browser application device using . ,service may use tracking pixel web beacon browser fingerprinting device fingerprinting user . 
use service imply approval present term . reserve right modify term time fit evolution service qwant operation . informed email appropriate mean affected service substantial change term prior entry force . ,reserve right modify term time fit evolution service qwant operation . informed email appropriate mean affected service substantial change term prior entry force . 
type information collect . type amount information receive store depends use website . access page website without telling u without revealing personal information . ,user access page service website without revealing personal information . 
uploading entering user content give grammarly work nonexclusive worldwide royalty free fully paid transferable sublicensable perpetual irrevocable license copy store use user content authorized user enterprise subscriber user content connection provision software service improve algorithm underlying software service . ,service use content existing future service . 
agree transmit service unlawful harassing libelous abusive threatening harmful material kind nature . agrees transmit material encourages conduct could constitute criminal offense give rise civil liability otherwise violate applicable local state national international law regulation . ,user agree submit libelous harassing threatening content . 
share post upload content covered intellectual property right like photo video connection product grant u non exclusive transferable sub licensable royalty free worldwide license host use distribute modify run copy publicly perform display translate create derivative work content consistent privacy application setting . ,scope copyright license granted facebook includes right transfer sublicense . mean content licensed facebook third party . 
may change service policy may need make change term accurately reflect service policy . unless otherwise required law notify example service make change term give opportunity review go effect . ,service want change term user notified week advance . 
please note privacy policy may change time time . reduce right policy without explicit consent expect change minor . regardless post policy change page . may amend privacy policy time posting amend term site . amended term shall automatically effective thirty 30 day initially posted site . version policy identified top page effective date . ,change term service time see fit even without notification user . use service supposedly constitutes acceptance change term . 
