original_text,reference_summary
time time may update privacy statement well specific privacy statement . making change privacy statement add new date top privacy statement . ,change term service time see fit even without notification user . use service supposedly constitutes acceptance change term . 
agree engage activity would constitute criminal offense give rise civil liability . ,user agree submit illegal content . 
cancelling account . cancel account email deleteaccount foxnews com subject delete account include email address registered account different email address sending email . ,delete content service . 
please note obligation delete story favorite comment listed profile otherwise remove association profile username . ,delete account service . 
youtube may retain display distribute perform server copy video removed deleted . ,service hold onto content deleted . 
may sole discretion suspend terminate account access service . ,service delete account without prior notice without reason . 
third party vendor including google use cooky serve ad based user prior visit website website . google use advertising cooky enables partner serve ad based visit site site internet . ,service allows tracking via third party cooky purpose including targeted advertising . 
provide submission whether email otherwise agree non confidential unless couchsurfing state otherwise writing shall become sole property couchsurfing . couchsurfing shall exclusive right including intellectual property right shall entitled unrestricted use dissemination submission purpose commercial otherwise . acknowledge couchsurfing obligated provide acknowledgment compensation exchange submission . ,offer suggestion service become owner idea give . 
affirm 13 year age older competent enter term condition obligation affirmation representation warranty set forth term service abide comply term service . case affirm 13 older service intended people 13. 13 year age please use service . ton fantastic website . ,term service state affirm 13 year age older competent enter term condition obligation affirmation representation warranty set forth term service abide comply term service . according must least 13 able agree term use service . 
solely responsible activity occurs account must keep account password secure . must notify youtube immediately breach security unauthorized use account . although youtube liable loss caused unauthorized use account may liable loss youtube others due unauthorized use . ,responsible maintaining security account activity account . 
22 4 provision term held invalid unenforceable provision struck affect validity enforceability remaining provision . ,invalidity portion term service entail invalidity remainder . 
must least 13 year old use service . minimum age use service without parental approval may higher home country . ,must least 13 year old use service . 
third party website website sometimes link third party website application . policy apply page application hosted operated organisation . includes website application amnesty international section related organisation third party site . site may privacy policy apply . ,service informs user privacy policy apply third party website . 
send track signal browser incorporated track dnt feature send signal website visit indicating wish tracked . yet common understanding interpret dnt signal service currently respond browser dnt signal . use range tool provide control data collection use including ability opt receiving marketing u described . ,even though track dnt header implemented perfectly service track user whose browser send dnt header . 
change term use . cnn may modify term use part thereof add remove term time modification addition deletion effective immediately upon posting . use site posting shall deemed constitute acceptance modification addition deletion . ,term may changed time discretion without notice user . 
fullest extent permitted applicable law event ibm liable party direct indirect incidental special exemplary consequential damage type whatsoever related arising web site use web site site resource linked referenced accessed web site use downloading access material information product service including without limitation lost profit business interruption lost saving loss program data even ibm expressly advised possibility damage . ,service assumes liability loss damage resulting matter relating service . 
want continue charged recurring monthly basis must cancel applicable paid subscription spotify account subscription page terminate spotify account end recurring monthly period . paid subscription terminated end period already paid except expressly provided term spotify refund fee already paid . limitation section set forth additional term regarding cancellation paid subscription . ,spotify provide refund . 
submit text hold copyright agree license creative common attribution sharealike 3 0 unported license cc sa gnu free documentation license gfdl unversioned invariant section front cover text back cover text . user may comply either license . exception project edition feature requires different license . case agree license text contribute particular license . ,wikipedia allows user hold copyright text submit creative common attribution sharealike 3 0 unported license cc sa gnu free documentation license gfdl unversioned invariant section front cover text back cover text . however allow contribution used commercially . 
may use third party service provider support provision service . relate business function including without limitation support hosting data cloud platform legal accounting audit consulting professional service provider provider service related business . portion service may provided organisation contractual relationship including subcontractor accordingly personal information may disclosed . provide organisation information need able perform service . ,third party may involved operating service . 
refraining certain activity may engage following activity service provided riseup net harassing abusing others engaging threat stalking sending spam . misuse service distributing virus malware engaging denial service attack attempting gain unauthorized access computer system including one . contributing abuse others distributing material production process created violence sexual assault person . account termination riseup net may terminate service time reason . typically however account destroyed one following condition account found sending spam excessive amount unsolicited email . account engaged one banned activity listed . ,service enforces censorship defined broad open interpretation manner . 
provide service software developed participated development well software developed third party . software open source free software according definition open source initiative osi free software foundation fsf . essential protect freedom leave proprietary component would stop setting server purpose migrate data kolab server . ,feature website made available free software license . 
device information described collect information computer phone connected tv web connected device use integrate product combine information across different device use . example use information collected use product phone better personalize content including ad feature see use product another device laptop tablet measure whether took action response ad showed phone different device . information obtain device includes device attribute information operating system hardware software version battery level signal strength available storage space browser type app file name type plugins . device operation information operation behavior performed device whether window foregrounded backgrounded mouse movement help distinguish human bot . identifier unique identifier device id identifier game apps account use family device id identifier unique facebook company product associated device account . device signal bluetooth signal information nearby wi fi access point beacon cell tower . data device setting information allow u receive device setting turn access gps location camera photo . network connection information name mobile operator isp language time zone mobile phone number ip address connection speed case information device nearby network thing like help stream video phone tv . cookie data data cooky stored device including cookie id setting . learn use cooky facebook cooky policy instagram cooky policy . ,collect data send username email credit card number kind info put well . plus info device . 
detect spam malware illegal content form abuse system violation policy may disable account take appropriate action . en quote use service improperly . fr quote n utilisez pa no service de façon impropre . ,user agree use service illegal purpose . 
although may attempt notify major change made term service periodically review date version . ,user revisit term periodically although case material change service notify . 
event liability exceed fee collected three month preceeding time claim arose . ,liability behalf service limited fee paid user . 
indemnity agree indemnify hold discogs subsidiary affiliate officer agent co branders partner employee harmless alleged claim demand including reasonable attorney fee made third party due arising use service connection service violation tos violation right another whether registered user . solely responsible action using service including limited cost incurred internet access . ,agree defend indemnify hold service harmless case claim related use service . 
must 18 accept term buy app must 18 accept term buy app . ,service available user certain age . 
banned patook whatever reason make attempt ever register account without patook written express permission . agree pay patook sum 1 000 create new account banned extra 1 000 subsequent account create banned . ,user fined 1000 register account banned however service notify user banned provides way check . 
licensing user content tos state cease using discogs service confirm discogs entitled continue using user generated content may continue display user name along content pursuant right granted . exercise right erasure deletion personal information pursuant privacy policy user generated content anonymized user name replaced generic term e previous user1234 simply user1234 ii discogs entitled continue using anonymized user generated content pursuant right granted . ,service continue using anonymized user generated content even erasure personal information . 
voluntarily providing u personal information consenting use accordance privacy policy agreeing may transferred office server pure authorized third party referred herein located united state . ,service share personal information third party . 
sell email address anyone . ,maintain ownership data . 
grammarly update revise agreement grammarly notify either email recently provided email address posting updated revised term service end user license agreement site manner chosen grammarly commercially reasonable discretion . ,term may changed time discretion without notice user . 
question concern novelty privacy policy data processing would like make complaint possible breach local privacy law please contact u novelty magazine ltd email address contact novelty medium postal address 1 habarzel street tel aviv israel 69710. telephone number 972 36209614 eu resident right make complaint time relevant supervisory authority . would however appreciate chance deal concern approach authority please contact u first instance . ,service provides complaint mechanism handling personal data . 
device information . addition log data may also collect information device using pinterest including type device operating system using device setting unique device identifier crash data . whether collect information often depends type device using setting . example different type information available depending whether using mac pc iphone android phone . learn information device make available u please also check policy device manufacturer software provider . ,service may use tracking pixel web beacon browser fingerprinting device fingerprinting user . 
likewise need collect personal data law enter carry contract provide data able enter contract . relates existing product using may suspend cancel . notify case time . ,opinion require data carry contract provide data immediately close account without prior notice . required personal data changed time may even customer basically suspension loophole . 
choice may decline participation activity asks information e survey email . choice participate effect ability access information city web site . ,choose share content . 
post change privacy policy revise last updated date top privacy policy . ,date last update term . 
work copyright title published using creative common licence . licence mean full control copyright choose work used people . recommend creative common attribution licence cc allows others copy distribute display perform copyrighted work ensures must give full credit . ,user free choose type copyright license want use content . 
using discogs website affiliated website indicating agreement bound term condition tos . ,user subject policy guideline service . 
without notice suspend terminate service time reason . example suspend terminate service late payment . b exceeding account spending limit . c harassing threatening abusing offending excessively impolite employee agent . interfering operation . e using suspicion using service way violates inconsistent agreement policy adversely affect customer reputation network property service . f breaching failing follow abusing agreement policy . g providing false inaccurate dated unverifiable information including identification credit information . h becoming insolvent bankrupt . modifying device manufacturer specification example rooting device . j failing use service maintain active device . k resell attempt resell service l believe action protects interest customer interest network . ,may stop providing service time . 
currently offer website functionality opt track signal listing . ,service ignores track dnt header track user anyway even set header . 
modification agreement tumblr reserve right modify agreement 1 posting revised agreement service 2 providing notice agreement changed generally via email practicable otherwise service notification tumblr dashboard mobile application . modification apply retroactively . responsible reviewing becoming familiar modification agreement . may sometimes ask review explicitly agree reject revised version agreement . case modification effective time agreement modified version agreement . agree time permitted use service . case ask explicit agreement modified version agreement otherwise provide notice set forth modified version agreement become effective fourteen day posted modified agreement provided notification modification . use service following period constitutes acceptance term condition agreement modified . agree modification permitted use discontinue use service . note prepaid paid service defined prior modification agreement use prepaid paid service governed version agreement effect time tumblr received prepayment . ,change term service time see fit notify user . use service supposedly constitutes acceptance change term . 
content adult sexual nature strictly prohibited . general guideline content must pg 13 . ,prohibits posting pornographic content . 
information collect third party company including limited publishing partner platform advertising platform partner data aggregator may include attribute interest well game service use demographic general location information . ,service may collect extra data promotion . 
rvices grant oath following worldwide royalty free non exclusive license license use distribute reproduce modify adapt publicly perform publicly display content service solely purpose content submitted made available . license exists long elect continue include content service terminate time remove oath remove content service . ,copyright license granted yahoo photo graphic audio video limited solely purpose content submitted made available . 
content belongs . decide whether license . minimum license npm provide content user npm service share content . special license allows npm copy publish analyze content share analysis others . npm may run computer code content analyze npm special license alone give npm right run code functionality npm product service . ,user free choose type copyright license want use content . 
advocate violent behavior . pose reasonable threat personal public safety . contains violent image killing physical abuse appear captured solely principally exploitive prurient gratuitous purpose . ,prohibits posting content promotes glorifies violence politically religiously extremist value . 
may optionally add information account profile name profile picture . information end end encrypted . ,service allows use pseudonym . 
use service chain letter junk mail spamming use distribution list person given specific permission included process . ,service prohibits user sending chain letter junk mail spam unsolicited message . 
transparency report state designed signal service minimize data retain signal user information produce response request like date time user registered signal last date user connectivity signal service . ,service track . 
call u immediately device lost stolen may responsible usage charge notify u alleged loss theft . lost stolen device affect term commitment still responsible early termination fee terminate service early . still responsible lease installment billing obligation well monthly recurring charge associated service device notify u alleged loss theft . agree cooperate choose investigate matter provide fact sworn statement etc . ,user responsible charge even device lost . 
15. class action waiver summary dispute related term service may consolidated class action . company agree bring participate class collective representative action private attorney general action collective arbitration even arbitration procedure rule would otherwise allow one . company also agree seek combine action action without consent party agreement action . agreement section bring participate class collective representative action private attorney general action collective arbitration found illegal unenforceable company agree shall severable entire section shall unenforceable claim dispute would resolved court class collective action . ,waive right class action . 
phoenix hosted heroku development purpose . please refer tos detail . ,tos dr refers user heroku term service information . 
softpedia allows company called third party ad server ad network serve advertisement within softpedia site . ,softpedia us third party targeted advertising . 
5 5 creating uploading posting sending receiving storing otherwise making available member content airbnb platform grant airbnb non exclusive worldwide royalty free irrevocable perpetual term protection sub licensable transferable license member content access use store copy modify prepare derivative work distribute publish transmit stream broadcast otherwise exploit manner member content provide promote airbnb platform medium platform . ,service use content existing future service . 
request refund nearly purchase steam reason . maybe pc meet hardware requirement . maybe bought game mistake . maybe played title hour like . matter . valve upon request via help steampowered com issue refund reason request made within fourteen day purchase title played le two hour . detail even fall outside refund rule described ask refund anyway take look . ,user entitled refund certain threshold standard met service . 
track request handled . website support track request . determine whether third party service us honor track request please read privacy policy . ,service ignores track dnt header track user anyway even set header . 
wish receive cooky set web browser restrict block . modern browser allow change cookie setting typically found option preference menu browser . order understand setting following link may helpful www aboutcookies org disable cooky able use interactive feature website . ,service employ third party cooky opt instruction . 
agree dispute u resolved binding individual arbitration waive right participate class action lawsuit class wide arbitration . explain exception opt arbitration . ,agreeing instagram term agree bring claim behalf . waive right part class action participating claim brought representative capacity . 
shall interfere another person use enjoyment service another entity use enjoyment similar service . ,user shall interfere another person enjoyment service . 
service term governed french law wherever originates use service . friendly solution found sought french court within competence cour appel de paris court competent know litigation arose current term . ,court law governing term france . 
security city taken step safeguard submission information implementing detailed technology security policy . security measure integrated design implementation day day operation entire operating environment part continuing commitment security electronic content well electronic transmission information . ,service prohibits user attempting gain unauthorized access computer system . 
company aggregate non personal data identify user . data includes apps installs frequency launch use different screen application . also collect non personalized data device model software version country application used language . also user may asked leave email get access certain additional feature . ,service provides detail kind personal information collect . 
signal message call accessed u third party always end end encrypted private secure . signal message picture file content stored locally device . content readable open source signal client . everything signal end end encrypted signal service access data . several community developed open source utility capable parsing locally stored signal content . android user also help u test new backup feature make possible move local signal data device signal setting chat medium chat backup . ,maintain ownership data . 
qwant qwant junior account data removed 7 day request account deleted . use edu qwant junior account edu qwantjunior com data removed 3 month account deletion request . period ask account reactivated using initial username password . data may collected exercize right access opposition rectification right forgotten duration retention depends law prescribes right . please refer next section privacy policy detail . connection data information system security department may access duration retention 6 month . qwant board french law make mandatory keep connection data e g. user id used url position nature operation time one year . name say right oppose allows oppose data processing qwant . may instance choose delete account . ask u information related ask u information regarding processing instance category data process . right allows ask qwant give information . ,request access deletion personal data . 
sharing data like address book contact anonymous usage statistic crash log completely optional part . opt anytime . ,privacy policy state sharing data like anonymous usage statistic crash log completely optional . 
finally may disclose personal information upon transfer sale another entity substantially asset equity security upon corporate reorganization . ,bittorrent may disclose personal data part transfer sale corporate reorganization . 
acknowledge combinator may establish general practice limit concerning use site including without limitation maximum period time data content retained site maximum storage space allotted combinator server behalf . agree combinator responsibility liability deletion failure store data content maintained uploaded site . ,service give guarantee regarding quality . 
delete account also delete information . ,good dropbox allows leave service . 
combinator may disclose personal data required law good faith belief action necessary comply legal obligation ii protect defend right property combinator individual associated combinator iii act urgent circumstance protect personal safety user site public iv protect legal liability . ,service share personal information third party . 
hereby agree indemnify defend hold harmless soundcloud successor assigns affiliate agent director officer employee shareholder claim obligation damage loss expense cost including reasonable attorney fee resulting violation term use community guideline ii third party claim infringement copyright intellectual property right invasion privacy arising hosting content platform making available thereof user platform actual use content user platform linked service accordance term use parameter set respect distribution sharing content iii activity related account person accessing account without consent unless activity caused act default soundcloud . ,agree indemnify soundcloud claim resulting third party infringement copyright invastion privacy related content activity related account . 
500px reserve right sole discretion modify replace term time . alteration constitute material change term 500px notify posting announcement site . constitutes material change determined 500px sole discretion . responsible reviewing becoming familiar modification . using service viewing visual content constitutes acceptance term modified . ,term may changed time discretion without notice user . 
enforcement term condition solely discretion failure enforce term condition instance constitute waiver right enforce instance . ,failure enforce provision term service constitute waiver provision . 
