original_text,reference_summary
site track way shape form . period . ,service track . 
policy substantively updated update text page provide notice http duckduckgo com writing updated red next link page footer period least 30 day . ,condition may change continued acceptance inferred earlier acceptance flow . 
agree licensors may make change service offered site time without notice agree revise term time without notice posting updated term site . ,term may changed time discretion without notice user . 
expressly understand agree discogs shall liable direct indirect incidental special consequential exemplary damage including limited damage loss profit goodwill use data intangible loss even discogs advised possibility damage resulting use inability use service . ii cost procurement substitute good service resulting good data information service purchased obtained message received transaction entered service . iii unauthorized access alteration transmission data . iv statement conduct third party service . v matter relating service . ,service assumes liability loss damage resulting matter relating service . 
supplementary data remaining portion database released creative common attribution noncommercial sharealike 3 0 license . ,publish free license bilateral one . 
extent provide user content grant coursera fully transferable royalty free perpetual sublicensable non exclusive worldwide license copy distribute modify create derivative work based publicly perform publicly display otherwise use user content . ,service use content existing future service . 
15 4 airbnb may immediately without notice terminate agreement stop providing access airbnb platform materially breached obligation term payment term policy standard ii violated applicable law regulation third party right iii airbnb belief good faith action reasonably necessary protect personal safety property airbnb member third party example case fraudulent behavior member . ,airbnb suspend account several reason . 
give u permission use name profile picture information action taken facebook next connection ad offer sponsored content display across product without compensation . ,identity used ad shown user . 
information requested real name optional unless accepting term behalf legal entity case need information legal entity opt paid account case additional information necessary billing purpose . ,agree provide full legal name register service . prevent using pseudonym . 
wish cancel account request longer use personal information provide service contact u support groupon com . retain use personal information necessary comply legal obligation resolve dispute enforce agreement . ,deactivate account groupon guarantee always delete record . 
access interact fox news service fox news service provider may collect certain information visit . example order permit connection fox news service server receive record information computer device browser including potentially ip address browser type software hardware information . access fox news service mobile device may collect unique device identifier assigned device geolocation data including precise location transactional information device . cooky tracking technology browser cooky pixel beacon adobe flash technology including cooky comprised small bit data . fox news website apps service send data browser first request web page store data computer device website app access information make subsequent request page service . technology may also used collect store information usage fox news service page visited video content viewed search query run advertisement seen . ,service may use tracking pixel web beacon browser fingerprinting device fingerprinting user . 
time data either deleted may retain secure anonymised record research analytical purpose . ,service may keep secure anonymized record user data analytical purpose even data retention period . 
except required applicable non u local national law law state california excluding conflict law rule govern term use service . ,court law governing term state california . 
furthermore city reading pa reserve right deny remove link contains misleading information unsubstantiated claim determined conflict city reading pa mission policy . ,prohibits posting content promotes glorifies violence politically religiously extremist value . 
refuse provide stop providing part service including terminating disabling account immediately protect community service create risk legal exposure u violate term use policy including instagram community guideline repeatedly infringe people intellectual property right permitted required law . ,service suspend account several reason . 
also notify either site user interface email notification reasonable mean . change become effective earlier fourteen 14 day posted except change addressing new function site change made legal reason effective immediately . ,service want change term user notified week advance . 
information shared others e g review forum posting may continue publicly visible airbnb platform even airbnb account cancelled . however attribution information removed . ,service continue using anonymized user generated content even erasure personal information . 
19. special provision subscriber located outside united state . ,tumblr provision user outside u . 
